{
  "authoringSchema": "QuestStrategyAuthoring/2alpha",
  "manifestVersion": "2026-08-03.10",
  "sourceSnapshot": {
    "repositoryCommit": "7f7dbfe03c84374079f0c0fcb6bc8b4817a57939",
    "questCatalogDigest": "sha256:267be70a980df7e8cc88a0042037618d18f05a026e5e1a9893bb88d7a6b2fce9",
    "curatedKnowledgeDigest": "sha256:fa161e193aacd8465016bf4a3989ad1935b1218e3ef0c4c9084c4391f71c8949"
  },
  "coveragePolicyId": "QSTRAT_RECURRING_NORMAL_SORTIE_V1",
  "questFacts": [
    {
      "factId": "quest:226:objective",
      "questId": 226,
      "revision": 1,
      "status": "approved",
      "origin": "canonical-projection",
      "lineage": {
        "module": "src/common/kcquest",
        "accessor": "getQuestStuff",
        "sourceCommit": "0505bc88f7e31c7c2ad84dc50b2f0e8c2bc34d56",
        "projectionDigest": "sha256:c44c57dad4e618bb81088f9050b37a2ecf7f9465ea5b70495e05621cf17372ac"
      },
      "classification": "lossless-v1",
      "objectiveStages": [
        {
          "requiredCount": 5,
          "targets": [
            { "mapKey": "2-1", "result": "victory", "targetCells": [] },
            { "mapKey": "2-2", "result": "victory", "targetCells": [] },
            { "mapKey": "2-3", "result": "victory", "targetCells": [] },
            { "mapKey": "2-4", "result": "victory", "targetCells": [] },
            { "mapKey": "2-5", "result": "victory", "targetCells": [] }
          ]
        }
      ],
      "review": {
        "author": "canonical-inventory-projection",
        "approver": "legacy-bundle-review-record",
        "reviewedAt": "2026-07-31T00:00:00.000Z",
        "reviewBy": "2026-10-29T00:00:00.000Z",
        "validUntil": "2027-07-31T00:00:00.000Z",
        "evidenceReviewIds": ["periodic-sortie-review"]
      }
    },
    {
      "factId": "quest:229:objective",
      "questId": 229,
      "revision": 1,
      "status": "approved",
      "origin": "canonical-projection",
      "lineage": {
        "module": "src/common/kcquest",
        "accessor": "getQuestStuff",
        "sourceCommit": "0505bc88f7e31c7c2ad84dc50b2f0e8c2bc34d56",
        "projectionDigest": "sha256:9465df11e0e8f5eaff50e05694ff777e96554683a7408987baf53bf6fdaba021"
      },
      "classification": "lossless-v1",
      "objectiveStages": [
        {
          "requiredCount": 12,
          "targets": [
            { "mapKey": "4-1", "result": "victory", "targetCells": [] },
            { "mapKey": "4-2", "result": "victory", "targetCells": [] },
            { "mapKey": "4-3", "result": "victory", "targetCells": [] },
            { "mapKey": "4-4", "result": "victory", "targetCells": [] },
            { "mapKey": "4-5", "result": "victory", "targetCells": [] }
          ]
        }
      ],
      "review": {
        "author": "canonical-inventory-projection",
        "approver": "legacy-bundle-review-record",
        "reviewedAt": "2026-07-31T00:00:00.000Z",
        "reviewBy": "2026-10-29T00:00:00.000Z",
        "validUntil": "2027-07-31T00:00:00.000Z",
        "evidenceReviewIds": ["periodic-sortie-review"]
      }
    },
    {
      "factId": "quest:241:objective",
      "questId": 241,
      "revision": 1,
      "status": "approved",
      "origin": "canonical-projection",
      "lineage": {
        "module": "src/common/kcquest",
        "accessor": "getQuestStuff",
        "sourceCommit": "971c71d235634a209bf0560c739f824cdc07faeb",
        "projectionDigest": "sha256:e5cbe39f193f6536562bfb5787ebacf04e37d9efdd633cf7c510b84ee883c029"
      },
      "classification": "lossless-v1",
      "objectiveStages": [
        {
          "requiredCount": 5,
          "targets": [
            { "mapKey": "3-3", "result": "victory", "targetCells": [] },
            { "mapKey": "3-4", "result": "victory", "targetCells": [] },
            { "mapKey": "3-5", "result": "victory", "targetCells": [] }
          ]
        }
      ],
      "review": {
        "author": "codex-r8-weekly-chain-fact-author",
        "approver": "project-owner",
        "reviewedAt": "2026-08-03T04:00:00.000Z",
        "reviewBy": "2026-11-03T00:00:00.000Z",
        "validUntil": "2027-02-03T00:00:00.000Z",
        "evidenceReviewIds": ["periodic-sortie-review"]
      }
    },
    {
      "factId": "quest:242:objective",
      "questId": 242,
      "revision": 1,
      "status": "approved",
      "origin": "canonical-projection",
      "lineage": {
        "module": "src/common/kcquest",
        "accessor": "getQuestStuff",
        "sourceCommit": "971c71d235634a209bf0560c739f824cdc07faeb",
        "projectionDigest": "sha256:e7d4b0af6348df5579734f4489747a04d20e70a72476121c8f4fe7e2d05a0b88"
      },
      "classification": "lossless-v1",
      "objectiveStages": [
        {
          "requiredCount": 1,
          "targets": [{ "mapKey": "4-4", "result": "victory", "targetCells": [] }]
        }
      ],
      "review": {
        "author": "codex-r8-weekly-chain-fact-author",
        "approver": "project-owner",
        "reviewedAt": "2026-08-03T04:00:00.000Z",
        "reviewBy": "2026-11-03T00:00:00.000Z",
        "validUntil": "2027-02-03T00:00:00.000Z",
        "evidenceReviewIds": ["periodic-sortie-review"]
      }
    },
    {
      "factId": "quest:243:objective",
      "questId": 243,
      "revision": 1,
      "status": "approved",
      "origin": "canonical-projection",
      "lineage": {
        "module": "src/common/kcquest",
        "accessor": "getQuestStuff",
        "sourceCommit": "971c71d235634a209bf0560c739f824cdc07faeb",
        "projectionDigest": "sha256:ddf437c222e8045d72d329db69cf4ff071368ed3d9c2c33bdafbaedb9c8d0090"
      },
      "classification": "lossless-v1",
      "objectiveStages": [
        {
          "requiredCount": 2,
          "targets": [{ "mapKey": "5-2", "result": "S", "targetCells": [] }]
        }
      ],
      "review": {
        "author": "codex-r8-weekly-chain-fact-author",
        "approver": "project-owner",
        "reviewedAt": "2026-08-03T04:00:00.000Z",
        "reviewBy": "2026-11-03T00:00:00.000Z",
        "validUntil": "2027-02-03T00:00:00.000Z",
        "evidenceReviewIds": ["periodic-sortie-review"]
      }
    },
    {
      "factId": "quest:257:objective",
      "questId": 257,
      "revision": 1,
      "status": "approved",
      "origin": "canonical-projection",
      "lineage": {
        "module": "src/common/kcquest",
        "accessor": "getQuestStuff",
        "sourceCommit": "0505bc88f7e31c7c2ad84dc50b2f0e8c2bc34d56",
        "projectionDigest": "sha256:45c0db38e169b22b45b1e19e6a6e4b05e02a8a316a7aeff9d2378e2614c96af2"
      },
      "classification": "opaque-constraint",
      "objectiveStages": [
        { "requiredCount": 1, "targets": [{ "mapKey": "1-4", "result": "S", "targetCells": [] }] }
      ],
      "review": {
        "author": "canonical-inventory-projection",
        "approver": "legacy-bundle-review-record",
        "reviewedAt": "2026-07-31T00:00:00.000Z",
        "reviewBy": "2026-10-29T00:00:00.000Z",
        "validUntil": "2027-07-31T00:00:00.000Z",
        "evidenceReviewIds": ["periodic-sortie-review"]
      }
    },
    {
      "factId": "quest:261:objective",
      "questId": 261,
      "revision": 1,
      "status": "approved",
      "origin": "canonical-projection",
      "lineage": {
        "module": "src/common/kcquest",
        "accessor": "getQuestStuff",
        "sourceCommit": "0505bc88f7e31c7c2ad84dc50b2f0e8c2bc34d56",
        "projectionDigest": "sha256:fab086c3bc9ad2b054c413906a603ada3d9b266e5173b89c5541537a9037e370"
      },
      "classification": "lossless-v1",
      "objectiveStages": [
        { "requiredCount": 3, "targets": [{ "mapKey": "1-5", "result": "A", "targetCells": [] }] }
      ],
      "review": {
        "author": "canonical-inventory-projection",
        "approver": "legacy-bundle-review-record",
        "reviewedAt": "2026-07-31T00:00:00.000Z",
        "reviewBy": "2026-10-29T00:00:00.000Z",
        "validUntil": "2027-07-31T00:00:00.000Z",
        "evidenceReviewIds": ["periodic-sortie-review"]
      }
    },
    {
      "factId": "quest:265:objective",
      "questId": 265,
      "revision": 1,
      "status": "approved",
      "origin": "canonical-projection",
      "lineage": {
        "module": "src/common/kcquest",
        "accessor": "getQuestStuff",
        "sourceCommit": "0505bc88f7e31c7c2ad84dc50b2f0e8c2bc34d56",
        "projectionDigest": "sha256:7b7ffa958b8d10ae6be0ad0fd75c4b24edf86df78957f8fdb4e40ffb32c3eab2"
      },
      "classification": "lossless-v1",
      "objectiveStages": [
        { "requiredCount": 10, "targets": [{ "mapKey": "1-5", "result": "A", "targetCells": [] }] }
      ],
      "review": {
        "author": "canonical-inventory-projection",
        "approver": "legacy-bundle-review-record",
        "reviewedAt": "2026-07-31T00:00:00.000Z",
        "reviewBy": "2026-10-29T00:00:00.000Z",
        "validUntil": "2027-07-31T00:00:00.000Z",
        "evidenceReviewIds": ["periodic-sortie-review"]
      }
    },
    {
      "factId": "quest:280:objective",
      "questId": 280,
      "revision": 1,
      "status": "approved",
      "origin": "canonical-projection",
      "lineage": {
        "module": "src/common/kcquest",
        "accessor": "getQuestStuff",
        "sourceCommit": "0505bc88f7e31c7c2ad84dc50b2f0e8c2bc34d56",
        "projectionDigest": "sha256:5c4b265f98cb096968bc0995d15a53809aa73aa8820c721910efb762ca322e4c"
      },
      "classification": "multi-stage",
      "objectiveStages": [
        { "requiredCount": 1, "targets": [{ "mapKey": "1-2", "result": "S", "targetCells": [] }] },
        { "requiredCount": 1, "targets": [{ "mapKey": "1-3", "result": "S", "targetCells": [] }] },
        { "requiredCount": 1, "targets": [{ "mapKey": "1-4", "result": "S", "targetCells": [] }] },
        { "requiredCount": 1, "targets": [{ "mapKey": "2-1", "result": "S", "targetCells": [] }] }
      ],
      "review": {
        "author": "canonical-inventory-projection",
        "approver": "legacy-bundle-review-record",